<?xml version="1.0" encoding="windows-1251"?>
<DECLAR xmlns:xsi="http://www.w3.org/2001/XMLSchema-instance" xsi:noNamespaceSchemaLocation="J1201009.xsd">
  <DECLARHEAD>
    <TIN>24447183</TIN>
    <C_DOC>J12</C_DOC>
    <C_DOC_SUB>010</C_DOC_SUB>
    <C_DOC_VER>9</C_DOC_VER>
    <C_DOC_TYPE>00</C_DOC_TYPE>
    <C_DOC_CNT>1000002</C_DOC_CNT>
    <C_REG>04</C_REG>
    <C_RAJ>65</C_RAJ>
    <PERIOD_MONTH>7</PERIOD_MONTH>
    <PERIOD_TYPE>1</PERIOD_TYPE>
    <PERIOD_YEAR>2017</PERIOD_YEAR>
    <C_STI_ORIG>0465</C_STI_ORIG>
    <C_DOC_STAN>1</C_DOC_STAN>
    <LINKED_DOCS xsi:nil="true" />
    <D_FILL>06072017</D_FILL>
    <SOFTWARE>iFin</SOFTWARE>
  </DECLARHEAD>
  <DECLARBODY>
    <H03 xsi:nil="true" />
    <R03G10S xsi:nil="true" />
    <HORIG1 xsi:nil="true" />
    <HTYPR xsi:nil="true" />
    <HFILL>13072017</HFILL>
    <HNUM>1</HNUM>
    <HNUM1 xsi:nil="true" />
    <HNAMESEL>Товариство з обмеженою відповідальністю "АЛАН"</HNAMESEL>
    <HNAMEBUY>тов мак</HNAMEBUY>
    <HKSEL>244471804626</HKSEL>
    <HNUM2 xsi:nil="true" />
    <HKBUY>123456789</HKBUY>
    <HFBUY xsi:nil="true" />
    <R04G11>2.40</R04G11>
    <R03G11>0.40</R03G11>
    <R03G7>0.40</R03G7>
    <R03G109 xsi:nil="true" />
    <R01G7>2.00</R01G7>
    <R01G109 xsi:nil="true" />
    <R01G9 xsi:nil="true" />
    <R01G8 xsi:nil="true" />
    <R01G10 xsi:nil="true" />
    <R02G11 xsi:nil="true" />
    <RXXXXG3S ROWNUM="1">прплорлдодлджлжд</RXXXXG3S>
    <RXXXXG4 ROWNUM="1" xsi:nil="true" />
    <RXXXXG32 ROWNUM="1" xsi:nil="true" />
    <RXXXXG33 ROWNUM="1" xsi:nil="true" />
    <RXXXXG4S ROWNUM="1">шт</RXXXXG4S>
    <RXXXXG105_2S ROWNUM="1">2009</RXXXXG105_2S>
    <RXXXXG5 ROWNUM="1">1.000000000000</RXXXXG5>
    <RXXXXG6 ROWNUM="1">2.000000000000</RXXXXG6>
    <RXXXXG008 ROWNUM="1">20</RXXXXG008>
    <RXXXXG009 ROWNUM="1" xsi:nil="true" />
    <RXXXXG010 ROWNUM="1">2.00</RXXXXG010>
    <RXXXXG011 ROWNUM="1" xsi:nil="true" />
    <HBOS>В. М. Крихта</HBOS>
    <HKBOS>2071800356</HKBOS>
    <R003G10S xsi:nil="true" />
  </DECLARBODY>
</DECLAR>